{
  "$schema": "https://json-schema.org/draft/2020-12/schema",
  "$id": "urn:bsc-audit:schema:derived-holonomy:v0.2",
  "title": "BSC exact derived-holonomy record",
  "$defs": {
    "scalar": {"oneOf": [{"type": "integer"}, {"type": "string", "pattern": "^-?[0-9]+(?:/[1-9][0-9]*)?$"}]},
    "matrix": {"type": "array", "maxItems": 128, "items": {"type": "array", "maxItems": 128, "items": {"$ref": "#/$defs/scalar"}}},
    "basisRecord": {
      "type": "object",
      "additionalProperties": false,
      "required": ["label", "meaning", "sha256"],
      "properties": {
        "label": {"type": "string", "minLength": 1, "maxLength": 256},
        "meaning": {"type": "string", "minLength": 1, "maxLength": 4096},
        "sha256": {"type": "string", "pattern": "^sha256:[0-9a-f]{64}$"}
      }
    },
    "complex": {
      "type": "object",
      "additionalProperties": false,
      "required": ["groups", "differentials", "basis"],
      "properties": {
        "groups": {"type": "object", "minProperties": 1, "maxProperties": 128, "propertyNames": {"pattern": "^(0|[1-9][0-9]*)$"}, "additionalProperties": {"type": "integer", "minimum": 0, "maximum": 128}},
        "differentials": {"type": "object", "maxProperties": 128, "propertyNames": {"pattern": "^(0|[1-9][0-9]*)$"}, "additionalProperties": {"$ref": "#/$defs/matrix"}},
        "basis": {"type": "object", "minProperties": 1, "maxProperties": 128, "propertyNames": {"pattern": "^(0|[1-9][0-9]*)$"}, "additionalProperties": {"type": "array", "maxItems": 128, "items": {"$ref": "#/$defs/basisRecord"}}}
      }
    },
    "transport": {
      "type": "object",
      "additionalProperties": false,
      "required": ["source", "target", "maps"],
      "properties": {
        "source": {"type": "string", "minLength": 1},
        "target": {"type": "string", "minLength": 1},
        "maps": {"type": "object", "maxProperties": 128, "propertyNames": {"pattern": "^(0|[1-9][0-9]*)$"}, "additionalProperties": {"$ref": "#/$defs/matrix"}}
      }
    },
    "relation": {
      "oneOf": [
        {
          "type": "object",
          "additionalProperties": false,
          "required": ["left_path", "right_path", "required_equivalence"],
          "properties": {
            "left_path": {"type": "array", "minItems": 1, "maxItems": 128, "items": {"type": "string", "minLength": 1}},
            "right_path": {"type": "array", "minItems": 1, "maxItems": 128, "items": {"type": "string", "minLength": 1}},
            "required_equivalence": {"const": "strict"}
          }
        },
        {
          "type": "object",
          "additionalProperties": false,
          "required": ["left_path", "right_path", "required_equivalence"],
          "properties": {
            "left_path": {"type": "array", "minItems": 1, "maxItems": 128, "items": {"type": "string", "minLength": 1}},
            "right_path": {"type": "array", "minItems": 1, "maxItems": 128, "items": {"type": "string", "minLength": 1}},
            "required_equivalence": {"const": "derived"}
          }
        },
        {
          "type": "object",
          "additionalProperties": false,
          "required": ["left_path", "right_path", "required_equivalence", "observation_projection", "kernel_inclusion"],
          "properties": {
            "left_path": {"type": "array", "minItems": 1, "maxItems": 128, "items": {"type": "string", "minLength": 1}},
            "right_path": {"type": "array", "minItems": 1, "maxItems": 128, "items": {"type": "string", "minLength": 1}},
            "required_equivalence": {"const": "observed_derived_exact_kernel"},
            "observation_projection": {"type": "string", "minLength": 1},
            "kernel_inclusion": {"type": "string", "minLength": 1}
          }
        }
      ]
    }
  },
  "type": "object",
  "additionalProperties": false,
  "required": ["holonomy_version", "field", "contexts", "transports", "relations"],
  "properties": {
    "holonomy_version": {"const": "0.2.0"},
    "field": {"const": "Q"},
    "contexts": {"type": "object", "minProperties": 1, "maxProperties": 128, "propertyNames": {"pattern": "^.{1,256}$"}, "additionalProperties": {"$ref": "#/$defs/complex"}},
    "transports": {"type": "object", "minProperties": 1, "maxProperties": 128, "propertyNames": {"pattern": "^.{1,256}$"}, "additionalProperties": {"$ref": "#/$defs/transport"}},
    "relations": {"type": "object", "minProperties": 1, "maxProperties": 128, "propertyNames": {"pattern": "^.{1,256}$"}, "additionalProperties": {"$ref": "#/$defs/relation"}}
  }
}
